id,name,role,term,email,imageUrl,slug,description
1,Max Mustermann,1. Vorsitzender,→ 2026,vorstand1[at]automobilclub-warendorf.de,/images/vorstand/max-mustermann.png,max-mustermann,"Max Mustermann ist seit 2020 der 1. Vorsitzende des AC Warendorf. Er ist verantwortlich für die strategische Ausrichtung des Vereins und repräsentiert den Club nach außen. Seine Leidenschaft gilt dem Jugend-Kartslalom."
2,Erika Musterfrau,Schatzmeisterin,→ 2025,schatzmeister[at]automobilclub-warendorf.de,/images/vorstand/erika-musterfrau.png,erika-musterfrau,"Erika Musterfrau verwaltet die Finanzen des Vereins mit großer Sorgfalt. Sie sorgt für eine solide finanzielle Basis und transparente Buchführung."
3,Maik Derksen,Programmierer,→ 2026,webmaster[at]automobilclub-warendorf.de,/images/vorstand/maik-derksen.png,maik-derksen,"Maik Derksen ist der technische Kopf hinter der Webseite und digitalen Präsenz des AC Warendorf. Er kümmert sich um die Programmierung und Wartung der Online-Systeme."
4,Sabine Sportlich,Sportleiterin,→ 2025,sportleiter[at]automobilclub-warendorf.de,/images/vorstand/sabine-sportlich.png,sabine-sportlich,"Sabine Sportlich organisiert alle sportlichen Aktivitäten des Vereins, insbesondere im Bereich Kart-Slalom. Sie ist Ansprechpartnerin für Training, Wettbewerbe und Reglements."
5,Klaus Kart,Jugendleiter,→ 2026,jugend[at]automobilclub-warendorf.de,/images/vorstand/klaus-kart.png,klaus-kart,"Klaus Kart ist der Hauptansprechpartner für unsere jungen Talente. Er betreut die Jugendgruppe, organisiert Trainingslager und fördert den Nachwuchs im Motorsport."
